No,Question,Option A,Option B,Option C,Option D,Option E,Correct Answer,Explanation,Competency
36,When might using the Cluster Autoscaler lead to increased costs if not carefully managed?,"If it scales down nodes too aggressively, causing workload disruption.",If it frequently adds new nodes for short-lived Pods that could have waited.,If it only uses the smallest available instance types from the cloud provider.,If it conflicts with Horizontal Pod Autoscaler settings.,If it disables node monitoring and alerting.,B,"If workloads frequently trigger scale-up events for Pods that only run briefly, the CA might provision new nodes that are then underutilized shortly after. Tuning CA settings (e.g., scan intervals, expander strategies) and ensuring Pods request appropriate resources can help mitigate this.",Autoscaling
37,"Besides FaaS, what other types of services sometimes fall under the ""serverless"" umbrella?","Managed databases, messaging queues, and API gateways that auto-scale and abstract infrastructure.",Traditional virtual machines with pay-as-you-go pricing.,Bare-metal servers provisioned via an API.,On-premises Kubernetes clusters managed using GitOps.,Desktop applications deployed via MSI installers.,A,"The ""serverless"" concept often extends beyond FaaS to include managed backend services (Backend-as-a-Service or BaaS) like databases (e.g., DynamoDB, Firestore), queues (e.g., SQS, Pub/Sub), and API gateways where the provider manages scaling, availability, and infrastructure, abstracting it from the user.",Serverless
38,What is the purpose of the CNCF Artifact Hub?,To store source code for all CNCF projects.,To provide a centralized web UI for finding and discovering cloud native packages and artifacts.,To run performance benchmarks on different Kubernetes distributions.,To manage user authentication and authorization for CNCF services.,To host container images for public use.,B,"Artifact Hub acts as a central repository for finding and exploring cloud native artifacts like Helm charts, OLM operators, Falco rules, OPA policies, etc. It aggregates information from various distributed repositories, making discovery easier.",Community and Governance
39,"Why is understanding the different personas (Developer, Operator, etc.) important when designing a cloud native platform or process?",It helps determine the pricing model for the platform.,It ensures the platform only uses CNCF Graduated projects.,"It allows tailoring tools, interfaces, and automation to meet the specific needs and workflows of each role.",It dictates the programming language used for building the platform itself.,It's primarily a marketing exercise with little technical impact.,C,"Different roles have different needs, priorities, and technical skills. Designing a platform or process with these personas in mind leads to better usability, adoption, and efficiency. For example, developers need easy self-service deployment, while operators need robust monitoring and control.",Roles and Personas
40,"The OpenTelemetry project, hosted by CNCF, aims to standardize which aspect of cloud native applications?",Container image formats and runtime execution.,Service mesh configuration and traffic management APIs.,"Generation, collection, and export of telemetry data (traces, metrics, logs).",Persistent storage provisioning and volume lifecycle management.,User authentication and authorization protocols.,C,"OpenTelemetry provides a vendor-neutral set of APIs, SDKs, and tools for instrumenting applications to generate telemetry data (traces, metrics, logs) and exporting that data to various observability backends, promoting interoperability in monitoring.",Open Standards
41,Which autoscaling component would be most directly impacted by poorly configured Pod readiness/liveness probes?,Cluster Autoscaler (CA),Vertical Pod Autoscaler (VPA),Horizontal Pod Autoscaler (HPA),Kubernetes Scheduler (kube-scheduler),metrics-server,C,"HPA relies on Pods being ready to serve traffic and uses metrics from those Pods. If readiness probes are misconfigured, Pods might not become ready, or might be incorrectly marked as unhealthy. This prevents HPA from accurately assessing load and making correct scaling decisions.",Autoscaling
42,What key operational burden is significantly reduced by adopting serverless FaaS compared to running the same code in containers on Kubernetes?,Writing Dockerfiles and building container images.,"Managing the underlying compute instances, OS patching, and runtime updates.",Defining Kubernetes Service and Ingress resources.,Implementing application-level logging and monitoring.,Managing source code in a version control system like Git.,B,"With FaaS, the provider manages the entire underlying infrastructure stack – physical servers, VMs, operating systems, patching, container runtimes (if used underneath), and language runtimes. The user focuses only on the function code.",Serverless
43,What is the relationship between the Linux Foundation (LF) and the Cloud Native Computing Foundation (CNCF)?,They are direct competitors offering similar services.,"CNCF is the parent organization, and LF is one of its projects.","LF is the parent non-profit foundation, and CNCF is a sub-foundation focused on cloud native.",They are completely unrelated organizations.,CNCF manages Linux kernel development; LF manages cloud native projects.,C,The Linux Foundation is a large non-profit technology consortium. The CNCF is one of its projects (a sub-foundation) specifically chartered to advance cloud native computing and host related open source projects.,Community and Governance
44,"From a Platform Operator's perspective, what is a major benefit of Application Developers adhering to standardized logging formats and exposing Prometheus metrics?",It reduces the number of programming languages the Operator needs to support.,It simplifies the setup and maintenance of centralized observability and monitoring systems.,It eliminates the need for Kubernetes RBAC policies.,It guarantees that applications will be completely bug-free.,It allows Operators to directly modify application source code.,B,"When applications follow standards for logging (e.g., structured JSON to stdout) and metrics (e.g., Prometheus exposition format), Operators can more easily configure and manage platform-wide tools (like log aggregators and Prometheus servers) to collect, analyze, and visualize this data effectively.",Roles and Personas
45,"What core principle do standards like OCI, CRI, CNI, and CSI all enable within the Kubernetes ecosystem?",Reduced complexity for application developers writing business logic.,Improved performance compared to non-standardized components.,"Modularity and interchangeability of components, fostering choice and innovation.",Automatic security patching for all involved components.,Consolidation of all functions into the kubelet binary.,C,"These standards define interfaces between different layers of the stack (runtime, networking, storage). This allows different implementations for each layer to be developed and used interchangeably, promoting modularity, preventing vendor lock-in, and allowing specialization.",Open Standards
46,"If VPA is configured in ""recommendation"" mode (updateMode: ""Off""), what does it do?",It automatically adjusts Pod resource requests/limits based on usage.,It scales the number of Pod replicas based on its recommendations.,It generates recommendations for resource requests/limits but does not apply them automatically.,It adds or removes cluster nodes based on resource recommendations.,It disables itself and provides no recommendations.,C,"In recommendation-only mode, VPA analyzes resource usage and updates the status.recommendation field of the VPA object with suggested values for requests/limits, but it doesn't modify the running Pods. This allows operators to review recommendations before applying them.",Autoscaling
47,Knative is a popular open source project often associated with serverless on Kubernetes. What core capabilities does Knative Serving provide?,Persistent block storage management for functions.,A framework for building complex stateful workflows.,Request-driven compute with autoscaling (including scale-to-zero) for deploying containers.,A distributed database optimized for serverless workloads.,A graphical user interface for managing Kubernetes clusters.,C,"Knative Serving builds on Kubernetes to provide features commonly associated with serverless/FaaS platforms, such as deploying containerized applications, automatically scaling them based on HTTP requests (including scaling down to zero), and managing revisions for easy rollouts/rollbacks.",Serverless
48,"What is a key characteristic of successful open source governance, as promoted by organizations like the CNCF?",Centralized control by a single sponsoring company.,Lack of clear processes for contribution or decision-making.,"Transparency, community participation, and clear contribution/leadership paths.",Frequent changes in project licensing terms.,Closed-door meetings for all technical decisions.,C,"Healthy open source projects thrive on transparency in decision-making, clear guidelines for how community members can contribute and potentially grow into leadership roles (maintainers, SIG leads), and active participation from a diverse set of contributors and users.",Community and Governance
49,An End User of a cloud native application interacts with the system differently than a Developer or Operator. What is the End User's primary interaction?,Pushing code commits to a Git repository.,Configuring monitoring alerts for application performance.,"Using the application's interface (e.g., web UI, mobile app) to consume its functionality.",Provisioning new nodes for the Kubernetes cluster.,Writing Kubernetes YAML manifests.,C,The End User is the consumer of the application built by Developers and run on the platform managed by Operators. Their interaction is typically through the application's intended interface to achieve a business goal or task.,Roles and Personas
50,"The rise of cloud native architectures has emphasized ""Immutable Infrastructure"". What does this principle mean in the context of deployments?",Infrastructure components are never patched or updated once deployed.,"Deployments are updated by creating new instances (e.g., containers, VMs) rather than modifying existing ones.",Only specific approved vendors can provide infrastructure components.,Infrastructure configuration is stored in mutable databases.,All infrastructure must run in a single availability zone for consistency.,B,"Immutable Infrastructure treats servers or containers as ephemeral units. Instead of updating an existing instance in-place, you build a new version (e.g., a new container image), deploy new instances based on it, and then decommission the old ones. This leads to more predictable and reliable deployments.",Open Standards